{
  "contract_version": "1.0.0",
  "agent_id": "research_codebase",
  "persona_name": "Charlie",
  "step": "research",
  "module": "demo-module",
  "feature": "demo-feature",
  "status": "complete",
  "generated_at": "2026-03-16T12:00:00Z",
  "summary": {
    "topic": "Demo research fixture",
    "investigation_areas": [
      "cli"
    ],
    "key_findings_count": 1,
    "open_questions_count": 0,
    "follow_up_round_used": false
  },
  "artifacts": {
    "primary_readme": ".agent-cli/test/fixtures/artifacts/demo-module/demo-feature/research/README.md",
    "status_json": ".agent-cli/test/fixtures/artifacts/demo-module/demo-feature/research/status.json"
  },
  "handoff": {
    "ready_for_next_agent": true,
    "recommended_next_agent": "module_orchestrator",
    "required_artifacts": [
      "primary_readme",
      "status_json"
    ],
    "required_inputs_for_next_agent": []
  },
  "validation": {
    "schema_valid": true,
    "artifact_complete": true,
    "runtime_trace_valid": true
  },
  "runtime": {
    "initiator": "test",
    "model": "gpt-5",
    "effort": "medium",
    "run_dir": ".agent-cli/test/fixtures/artifacts/demo-module/demo-feature/research",
    "execution_mode": "inline",
    "agent_profile": null
  }
}
