{
  "contract_version": "1.0.0",
  "agent_id": "research_codebase",
  "persona_name": "Charlie",
  "step": "research",
  "module": "valid-review-module",
  "feature": "restore-executable-npm-test",
  "status": "complete",
  "generated_at": "2026-03-16T16:50:00Z",
  "summary": {
    "topic": "Review-gate research fixture",
    "investigation_areas": [
      "runtime path",
      "safe change points"
    ],
    "key_findings_count": 2,
    "open_questions_count": 0,
    "follow_up_round_used": false
  },
  "artifacts": {
    "primary_readme": ".agent-cli/test/fixtures/maestro/valid-review-module/restore-executable-npm-test/research/README.md",
    "status_json": ".agent-cli/test/fixtures/maestro/valid-review-module/restore-executable-npm-test/research/status.json"
  },
  "handoff": {
    "ready_for_next_agent": false,
    "recommended_next_agent": "module_orchestrator",
    "required_artifacts": [
      "primary_readme",
      "status_json"
    ],
    "required_inputs_for_next_agent": [
      "Maestro review of the research findings."
    ]
  },
  "validation": {
    "schema_valid": true,
    "artifact_complete": true,
    "runtime_trace_valid": true
  },
  "runtime": {
    "initiator": "codex",
    "model": "gpt-5",
    "effort": "medium",
    "run_dir": ".agent-cli/test/fixtures/maestro/valid-review-module/restore-executable-npm-test/research",
    "execution_mode": "inline",
    "agent_profile": null
  }
}
