{
  "contract_version": "1.0.0",
  "agent_id": "research_codebase",
  "persona_name": "Charlie",
  "step": "research",
  "module": "{{module}}",
  "feature": "{{feature}}",
  "status": "pending",
  "generated_at": "{{runtime_generated_at}}",
  "summary": {
    "topic": "{{topic}}",
    "investigation_areas": [],
    "key_findings_count": 0,
    "open_questions_count": 0,
    "follow_up_round_used": false
  },
  "artifacts": {
    "primary_readme": "{{artifact_primary_path}}",
    "status_json": "{{artifact_status_path}}"
  },
  "handoff": {
    "ready_for_next_agent": false,
    "recommended_next_agent": "module_orchestrator",
    "required_artifacts": [
      "primary_readme",
      "status_json"
    ],
    "required_inputs_for_next_agent": []
  },
  "validation": {
    "schema_valid": false,
    "artifact_complete": false,
    "runtime_trace_valid": false
  },
  "runtime": {
    "initiator": "{{runtime_initiator}}",
    "model": "{{runtime_model}}",
    "effort": "{{runtime_effort}}",
    "run_dir": "{{artifact_dir}}",
    "execution_mode": "inline",
    "agent_profile": null
  }
}
